{
  "schemaVersion": "1.0",
  "release": "2026-07-29.3",
  "status": "CANONICAL_TRACEABILITY",
  "blockers": [
    {
      "id": "EXT-001",
      "legacyAliases": [
        "C003",
        "C062",
        "C063",
        "C064",
        "C065",
        "G01",
        "G22",
        "G23",
        "G29"
      ],
      "claimIds": [
        "SCOPE_LOCKED",
        "REQUIREMENTS_TRACED",
        "SBOM_PROVENANCE_SIGNED",
        "EVIDENCE_BOUND_TO_RELEASE"
      ],
      "status": "BLOCKED_EXTERNAL",
      "directGateIds": [
        "SCOPE_AND_TRACEABILITY",
        "SUPPLY_CHAIN",
        "RELEASE_APPROVAL"
      ],
      "dependentGateIds": [],
      "ownerRole": "RELEASE_OWNER",
      "reviewerRole": "INDEPENDENT_RELEASE_REVIEWER",
      "portal": "INTERNAL_RELEASE_CONTROL_AND_PROTECTED_CI",
      "evidencePath": "delivery/evidence/artifacts/release-assurance/",
      "verificationCommand": "tools/check_release_contract.py plus protected CI artifact verification",
      "successCriteria": "The exact release subject, signed SBOM, signed provenance, protected branch controls, and two-person approval are independently verified.",
      "requiredMaterials": [
        "exact release subject",
        "signed SBOM",
        "signed provenance",
        "branch protection and CODEOWNERS evidence",
        "independent approval record"
      ],
      "secretsPolicy": "NO_SECRETS_IN_REPOSITORY_OR_CHAT",
      "featureFlags": [
        "PRODUCTION_WRITE_DISABLED_UNTIL_RELEASE_APPROVAL"
      ],
      "revalidateBy": "REVALIDATE_ON_EVERY_RELEASE",
      "escalationContact": "NOT_REGISTERED_EXTERNAL_ESCALATION_CONTACT"
    },
    {
      "id": "EXT-002",
      "legacyAliases": [
        "C045",
        "C049",
        "C050",
        "C051",
        "C076",
        "G15",
        "G17",
        "G29"
      ],
      "claimIds": [
        "ANDROID_BUILD_SIGNED",
        "ANDROID_DEVICE_MATRIX",
        "ANDROID_PLATFORM_SECURITY",
        "ATTESTATION_VERIFIED_SERVER_SIDE",
        "UNSUPPORTED_DEVICE_POLICY",
        "WCAG_AND_NATIVE_A11Y",
        "COGNITIVE_COMPREHENSION"
      ],
      "status": "BLOCKED_EXTERNAL",
      "directGateIds": [
        "ANDROID_RELEASE",
        "DEVICE_ATTESTATION",
        "ACCESSIBILITY"
      ],
      "dependentGateIds": [
        "USER_ACCEPTANCE"
      ],
      "ownerRole": "ANDROID_RELEASE_OWNER",
      "reviewerRole": "MOBILE_SECURITY_REVIEWER",
      "portal": "GOOGLE_PLAY_CONSOLE_AND_PROTECTED_DEVICE_LAB",
      "evidencePath": "delivery/evidence/artifacts/android/",
      "verificationCommand": "Gradle wrapper assembleRelease plus signed APK/AAB and physical-device matrix",
      "successCriteria": "A reproducible signed Android artifact passes the declared device, attestation, accessibility, and user-comprehension cases.",
      "requiredMaterials": [
        "Gradle wrapper and locked dependencies",
        "signed APK or AAB",
        "physical-device matrix",
        "server-side attestation evidence",
        "TalkBack and accessibility report"
      ],
      "secretsPolicy": "SIGNING_KEYS_STAY_IN_PROTECTED_KEYSTORE_AND_ARE_NOT_EXPORTED",
      "featureFlags": [
        "ANDROID_PRODUCTION_WRITE_DISABLED"
      ],
      "revalidateBy": "REVALIDATE_ON_EVERY_RELEASE",
      "escalationContact": "NOT_REGISTERED_GOOGLE_PLAY_ESCALATION_CONTACT"
    },
    {
      "id": "EXT-003",
      "legacyAliases": [
        "C048",
        "C049",
        "C050",
        "C051",
        "C077",
        "G16",
        "G17",
        "G28",
        "G29"
      ],
      "claimIds": [
        "IOS_BUILD_SIGNED",
        "IOS_DEVICE_MATRIX",
        "IOS_PLATFORM_SECURITY",
        "ATTESTATION_VERIFIED_SERVER_SIDE",
        "UNSUPPORTED_DEVICE_POLICY",
        "WCAG_AND_NATIVE_A11Y",
        "COGNITIVE_COMPREHENSION",
        "APPLE_ORGANIZATION_ELIGIBLE",
        "APPLE_REVIEW_APPROVED"
      ],
      "status": "BLOCKED_EXTERNAL",
      "directGateIds": [
        "IOS_RELEASE",
        "DEVICE_ATTESTATION",
        "ACCESSIBILITY",
        "APPLE_DISTRIBUTION"
      ],
      "dependentGateIds": [
        "USER_ACCEPTANCE"
      ],
      "ownerRole": "IOS_RELEASE_OWNER",
      "reviewerRole": "MOBILE_SECURITY_REVIEWER",
      "portal": "APPLE_DEVELOPER_ACCOUNT_APP_STORE_CONNECT_AND_PROTECTED_DEVICE_LAB",
      "evidencePath": "delivery/evidence/artifacts/ios/",
      "verificationCommand": "xcodebuild archive exportArchive plus signed IPA and physical-device matrix",
      "successCriteria": "A reproducible signed iOS app target passes the declared device, attestation, accessibility, and user-comprehension cases.",
      "requiredMaterials": [
        "Xcode project and locked dependencies",
        "signed IPA",
        "physical-device matrix",
        "App Attest server verification evidence",
        "VoiceOver and accessibility report"
      ],
      "secretsPolicy": "CERTIFICATES_AND_PROFILES_STAY_IN_PROTECTED_APPLE_ACCOUNT_WORKFLOWS",
      "featureFlags": [
        "IOS_PRODUCTION_WRITE_DISABLED"
      ],
      "revalidateBy": "REVALIDATE_ON_EVERY_RELEASE",
      "escalationContact": "NOT_REGISTERED_APPLE_ESCALATION_CONTACT"
    },
    {
      "id": "EXT-004",
      "legacyAliases": [
        "C034",
        "C035",
        "C036",
        "C037",
        "C038",
        "C039",
        "G12",
        "G13",
        "G21",
        "G30"
      ],
      "claimIds": [
        "HL_API_VERSION_PINNED",
        "HL_ORDER_LIFECYCLE_TESTED",
        "HL_MARGIN_MODEL_VERIFIED",
        "LIQUIDATION_PREVIEW_VALIDATED",
        "STALE_OR_UNKNOWN_BLOCKED",
        "TESTNET_ALL_FLOWS",
        "TESTNET_NO_UNEXPLAINED_DIFF",
        "ZERO_UNEXPLAINED_DIFFERENCE"
      ],
      "status": "BLOCKED_EXTERNAL",
      "directGateIds": [
        "HYPERLIQUID_INTEGRATION",
        "LIQUIDATION_RISK",
        "TESTNET_E2E",
        "RECONCILIATION_LEDGER"
      ],
      "dependentGateIds": [],
      "ownerRole": "PROTOCOL_INTEGRATION_OWNER",
      "reviewerRole": "INDEPENDENT_PROTOCOL_AUDITOR",
      "portal": "HYPERLIQUID_TESTNET_AND_PROVIDER_CONTRACT_REVIEW",
      "evidencePath": "delivery/evidence/artifacts/protocol/",
      "verificationCommand": "Pinned official protocol vectors plus read-only staging, Testnet end-to-end, and reconciliation replay",
      "successCriteria": "Every supported Hyperliquid lifecycle and liquidation-preview path is tested against a hash-pinned official source and reconciles with zero unexplained difference.",
      "requiredMaterials": [
        "official source pin",
        "SDK lock",
        "read-only staging transcript",
        "Testnet transaction evidence",
        "reconciliation ledger"
      ],
      "secretsPolicy": "TESTNET_CREDENTIALS_STAY_OUTSIDE_THE_PACKAGE_AND_MAINNET_WRITES_REMAIN_DISABLED",
      "featureFlags": [
        "TESTNET_ONLY",
        "MAINNET_WRITE_DISABLED"
      ],
      "revalidateBy": "REVALIDATE_ON_EVERY_EXTERNAL_CHANGE",
      "escalationContact": "NOT_REGISTERED_PROTOCOL_ESCALATION_CONTACT"
    },
    {
      "id": "EXT-005",
      "legacyAliases": [
        "C027",
        "C082",
        "G09",
        "G11",
        "G32"
      ],
      "claimIds": [
        "JPYC_OFFICIAL_DATA_PINNED",
        "JPYC_EX_CONTRACTED_TESTED",
        "REGISTRY_SIGNED_PINNED",
        "TOKEN_BEHAVIOR_ALLOWLIST",
        "VENDORS_CONTRACTED",
        "JP_LEGAL_OPINION"
      ],
      "status": "BLOCKED_EXTERNAL",
      "directGateIds": [
        "JPYC_INTEGRATION",
        "ASSET_REGISTRY",
        "PROVIDER_CONTRACTS",
        "LEGAL_JAPAN"
      ],
      "dependentGateIds": [],
      "ownerRole": "ASSET_REGISTRY_OWNER",
      "reviewerRole": "INDEPENDENT_LEGAL_AND_PROTOCOL_REVIEWER",
      "portal": "JPYC_OFFICIAL_REGISTRY_AND_JAPAN_COMPLIANCE_REVIEW",
      "evidencePath": "delivery/evidence/artifacts/assets/",
      "verificationCommand": "Official JPYC registry pin plus contract-behavior vectors and legal sign-off",
      "successCriteria": "JPYC contract identity, behavior allowlist, provider contracts, and Japan legal classification are independently verified.",
      "requiredMaterials": [
        "official registry pin",
        "contract address and chain identity",
        "contract-behavior test vectors",
        "provider contract",
        "legal opinion"
      ],
      "secretsPolicy": "NO_PROVIDER_CREDENTIALS_OR_PRIVATE_KEYS_IN_REPOSITORY",
      "featureFlags": [
        "JPYC_INTEGRATION_DISABLED_UNTIL_REGISTRY_PINNED"
      ],
      "revalidateBy": "REVALIDATE_ON_EVERY_EXTERNAL_CHANGE",
      "escalationContact": "NOT_REGISTERED_JPYC_ESCALATION_CONTACT"
    },
    {
      "id": "EXT-006",
      "legacyAliases": [
        "C083",
        "C084",
        "C085",
        "G10",
        "G31",
        "G32",
        "G33"
      ],
      "claimIds": [
        "ZERO_GAS_PATH_PROVEN",
        "FEE_QUOTE_BOUND_CAPPED",
        "FEE_BUDGET_CONCURRENT_SAFE",
        "VENDORS_CONTRACTED",
        "VENDOR_EXIT_AND_OUTAGE",
        "ZERO_UNEXPLAINED_DIFFERENCE",
        "NO_BLIND_RETRY"
      ],
      "status": "BLOCKED_EXTERNAL",
      "directGateIds": [
        "FEE_READINESS",
        "PROVIDER_CONTRACTS",
        "RECONCILIATION_LEDGER",
        "FAILURE_RECOVERY"
      ],
      "dependentGateIds": [],
      "ownerRole": "FEE_AND_RECOVERY_OWNER",
      "reviewerRole": "INDEPENDENT_RECONCILIATION_REVIEWER",
      "portal": "FEE_PROVIDER_CONTRACT_AND_LEDGER_REVIEW",
      "evidencePath": "delivery/evidence/artifacts/fees/",
      "verificationCommand": "Fee quote cap tests, concurrent budget tests, provider outage drill, and ledger reconciliation",
      "successCriteria": "The zero-gas path or bounded fee route is proven, concurrent reservations are safe, provider outage is recoverable, and ledger differences are zero.",
      "requiredMaterials": [
        "fee-route contract",
        "quote hash and expiry evidence",
        "concurrency test report",
        "outage and recovery drill",
        "double-entry reconciliation report"
      ],